{
 "id": "p111",
 "reader": "B",
 "model": "opus",
 "running_head": "PARLEMENT DE THOLOSE.",
 "folio": "111",
 "signature": null,
 "catchword": null,
 "ornaments": [],
 "blocks": [
  {
   "type": "paragraph",
   "continues_prev": true,
   "continues_next": false,
   "lines": [
    "de S. Iean diſoit, que c'eſtoit Elie {g}, que le Seigneur",
    "Dieu auoit promis par le Prophe {h}. non point dit S.",
    "Auguſtin, que Ieſus entendit S. Iean eſtre la meſme per",
    "ſonne d'Elie: mais par imitation de vertu {i}. Autrement,",
    "qui change de nom, doit eſtre puni & reprimé par pei",
    "ne de faux {k}. & telle, (diſoit en quelque lieu le Iuriſcon-",
    "ſulte Vlpien qu'il en ſoit) autres aux exemple {l}."
   ]
  },
  {
   "type": "heading",
   "text": "TEXTE.",
   "spaced_caps": true
  },
  {
   "type": "heading",
   "text": "Suppoſition de nom, & perſonne."
  },
  {
   "type": "heading",
   "text": "ANNOTAT. LXXXII.",
   "spaced_caps": true
  },
  {
   "type": "paragraph",
   "continues_prev": false,
   "continues_next": true,
   "lines": [
    "Arnauld du Tilh auoit ſuppoſé le nom & la perſonne",
    "de Martin Guerre, & ſi ſubtilement tendu tant de la-",
    "çons pour appaſter, & entretenir chacun à la perſuaſiõ",
    "de telle impoſture, que leſdits de Rols femme, ſeurs,",
    "oncle, & parens d'iceluy Martin, y furẽt endormis trois",
    "ans & d'auantage: ſuppoſition notable certes, ſ'il en fut",
    "oncques deſcouuerte, & digne d'atroce, cuelle, & exem",
    "plaire punition {a}, bien que de ce crime, noz loix, & ca-",
    "nons, ayent fort ſobrement, & ſi rarement parlé, qu'il",
    "ne ſe trouue aucun texte qui puiſſe propremẽt apparte",
    "nir à ce fait. Il eſt vray, que Modeſtin parlant de celuy",
    "lequel n'eſtant point ſoldat, neantmoins ſe dit & main",
    "tient pour tel: ou qui vſe d'enſeignes & armoiries de-",
    "fenduës, on bien ſuppoſe fauſſes lettres du Prince, veut",
    "& ordonne qu'il ſoit treſgriefuement puni {b}. Le Pape",
    "Clement iij, auſſi fait mention d'vn preſtre qui auoit",
    "prins le nom, & le titre de fils de Roy, & ſous ce man-",
    "teau. prins les armes, & excité vne grande ſedition: de la",
    "peine, n'en dit pas vn ſeul mot {c}. Il eſt auſſi parlé de ie ne",
    "ſçay quel Barbare Philippe ſerf, qui ſe preſenta au peu",
    "ple Romain, comme vne perſonne franche, & comme",
    "telle en rapporta la dignité de Preteur. mais ſ'il fit",
    "bien ou mal, le Iuriſconſulte n'en ouure pas vne ſeule",
    "parole {d}. Chacun ſçait auſſi, qu'il eſt fait mention en",
    "noſtre droit, de la ſuppoſition des enfans {e}. Mais quoy?",
    "ce ſont tous crimes diuers, & ſeparez de ceſtuy-ci.",
    "& ne ſeroit certainement aiſé donner certaines reigles",
    "ſur la peine: tant par ce que noz loix n'en ont rien de",
    "terminé. que pour autant auſſi, que les anciens ont"
   ]
  }
 ],
 "margin_notes": [
  {
   "key": "g",
   "beside_line": "de S. Iean diſoit, que c'eſtoit Elie {g}, que le Seigneur",
   "lines": [
    "S. Mathieu",
    "c. xi."
   ]
  },
  {
   "key": "h",
   "beside_line": "Auguſtin, que Ieſus entendit S. Iean eſtre la meſme per",
   "lines": [
    "Malachie c.",
    "iiij."
   ]
  },
  {
   "key": "i",
   "beside_line": "ſonne d'Elie: mais par imitation de vertu {i}. Autrement,",
   "lines": [
    "c. quæritur",
    "xxij. q. ij."
   ]
  },
  {
   "key": "k",
   "beside_line": "ne de faux {k}. & telle, (diſoit en quelque lieu le Iuriſcon-",
   "lines": [
    "l. falſi. D. de",
    "falſ."
   ]
  },
  {
   "key": "l",
   "beside_line": "ſulte Vlpien qu'il en ſoit) autres aux exemple {l}.",
   "lines": [
    "l. quamuis.",
    "D. de reb. cor."
   ]
  },
  {
   "key": "a",
   "beside_line": "plaire punition {a}, bien que de ce crime, noz loix, & ca-",
   "lines": [
    "l. quamuis",
    "D. de reb. cor."
   ]
  },
  {
   "key": "b",
   "beside_line": "& ordonne qu'il ſoit treſgriefuement puni {b}. Le Pape",
   "lines": [
    "l. eos. P fin.",
    "D. de falſi.."
   ]
  },
  {
   "key": "c",
   "beside_line": "peine, n'en dit pas vn ſeul mot {c}. Il eſt auſſi parlé de ie ne",
   "lines": [
    "c. perpendi",
    "mus. de ſent.",
    "excom."
   ]
  },
  {
   "key": "d",
   "beside_line": "parole {d}. Chacun ſçait auſſi, qu'il eſt fait mention en",
   "lines": [
    "l. ij. D.",
    "offi. prætor. de"
   ]
  },
  {
   "key": "e",
   "beside_line": "ce ſont tous crimes diuers, & ſeparez de ceſtuy-ci.",
   "lines": [
    "l. i. P. fi. & l.",
    "ij. D. de Ca.",
    "bo. edic. l. i. C.",
    "de fal."
   ]
  }
 ],
 "foot_notes": [],
 "uncertain": [
  {
   "where": "margin_notes",
   "text": "g h i k l / a b c d e",
   "note": "markers g-l continue the restarted alphabet of ANNOT. LXXXI (keyed a2-f2 on p110); keyed here as plain g, h, i, k, l since no letter repeats on this page; arbiter may prefer g2-l2. ANNOTAT. LXXXII restarts at a (keys a-e)"
  },
  {
   "where": "blocks[0].lines[1]",
   "text": "Dieu auoit promis par le Prophe {h}. non point dit S.",
   "note": "sic: 'Prophe' (for 'Prophete'); lowercase 'non' after the period as printed"
  },
  {
   "where": "blocks[0].lines[2]",
   "text": "Auguſtin, que Ieſus entendit S. Iean eſtre la meſme per",
   "note": "'que Ieſus' set tight ('queleſus'), the I looks like l; 'eſtre' r broken, looks like 'eſtie'"
  },
  {
   "where": "blocks[0].lines[3]",
   "text": "ſonne d'Elie: mais par imitation de vertu {i}. Autrement,",
   "note": "'Autrement' final letters damaged (looks like 'Autremẽnt'/'Autremeut'); mark after Elie read as colon"
  },
  {
   "where": "blocks[0].lines[5]",
   "text": "ne de faux {k}. & telle, (diſoit en quelque lieu le Iuriſcon-",
   "note": "marker printed as a small x-like k; 'telle' as printed (sense unclear)"
  },
  {
   "where": "blocks[0].lines[6]",
   "text": "ſulte Vlpien qu'il en ſoit) autres aux exemple {l}.",
   "note": "print sets a space before ')'; normalized. Wording 'autres aux exemple' as printed"
  },
  {
   "where": "blocks[2].text",
   "text": "Suppoſition de nom, & perſonne.",
   "note": "a stray accent-like mark over the u of 'Suppoſition'; not transcribed"
  },
  {
   "where": "blocks[3].text",
   "text": "ANNOTAT. LXXXII.",
   "note": "small capitals, letterspaced"
  },
  {
   "where": "blocks[4].lines[6]",
   "text": "oncques deſcouuerte, & digne d'atroce, cuelle, & exem",
   "note": "sic: 'cuelle' (for 'cruelle')"
  },
  {
   "where": "blocks[4].lines[7]",
   "text": "plaire punition {a}, bien que de ce crime, noz loix, & ca-",
   "note": "line-end sign after 'ca' is a small raised dot; read as hyphen"
  },
  {
   "where": "blocks[4].lines[13]",
   "text": "fenduës, on bien ſuppoſe fauſſes lettres du Prince, veut",
   "note": "'fenduës' with diaeresis as printed; 'on' for 'ou' as printed"
  },
  {
   "where": "blocks[4].lines[15]",
   "text": "Clement iij, auſſi fait mention d'vn preſtre qui auoit",
   "note": "mark after 'iij' could be comma or period; read as comma"
  },
  {
   "where": "blocks[4].lines[16]",
   "text": "prins le nom, & le titre de fils de Roy, & ſous ce man-",
   "note": "line-end sign after 'man' is a raised dot; read as hyphen"
  },
  {
   "where": "blocks[4].lines[17]",
   "text": "teau. prins les armes, & excité vne grande ſedition: de la",
   "note": "mark after 'teau' read as period (round dot); could be a comma"
  },
  {
   "where": "blocks[4].lines[19]",
   "text": "ſçay quel Barbare Philippe ſerf, qui ſe preſenta au peu",
   "note": "a blot/stray sort sits over the final a of 'preſenta'; 'Philippe' with a stray dot above"
  },
  {
   "where": "blocks[4].lines[22]",
   "text": "bien ou mal, le Iuriſconſulte n'en ouure pas vne ſeule",
   "note": "'ouure' as printed (first letter slightly damaged, could be 'onure')"
  },
  {
   "where": "blocks[4].lines[25]",
   "text": "ce ſont tous crimes diuers, & ſeparez de ceſtuy-ci.",
   "note": "hyphen in 'ceſtuy-ci' printed as a raised dot"
  },
  {
   "where": "blocks[4].lines[28]",
   "text": "terminé. que pour autant auſſi, que les anciens ont",
   "note": "mark after 'terminé' is a round dot at the baseline, read as period (sense wants comma)"
  },
  {
   "where": "margin_notes[0].lines[1]",
   "text": "c. xi.",
   "note": "final period faint; may be absent"
  },
  {
   "where": "margin_notes[1].lines[1]",
   "text": "iiij.",
   "note": "printed 'iiÿ' (ij ligature); read iiij"
  },
  {
   "where": "margin_notes[2]",
   "text": "c. quæritur / xxij. q. ij.",
   "note": "æ in 'quæritur' looks like 'a' with ligature; numerals printed with ÿ-shape ij ligature"
  },
  {
   "where": "margin_notes[6].lines[1]",
   "text": "D. de falſi..",
   "note": "two dots printed after 'falſi' as printed"
  },
  {
   "where": "margin_notes[8]",
   "text": "l. ij. D. / offi. prætor. de",
   "note": "'ij' printed ÿ-shape; 'prætor' æ unclear (could be 'prator'); last word could be 'da'"
  },
  {
   "where": "margin_notes[9]",
   "text": "l. i. P. fi. & l. / ij. D. de Ca. / bo. edic. l. i. C. / de fal.",
   "note": "after '& l' a small mark (period or superscript sign) with a dash below; 'Ca.' probably for Carbo-; 'ij' printed ÿ-shape"
  }
 ]
}
