{
 "id": "p057",
 "reader": "A",
 "model": "sonnet",
 "running_head": "PARLEMENT DE THOLOSE",
 "folio": "57",
 "signature": null,
 "catchword": null,
 "blocks": [
  {
   "type": "paragraph",
   "continues_prev": true,
   "continues_next": false,
   "lines": [
    "adonné à toute eſpece de larrecins, & af-",
    "frontemens: ordinaire renieur & blaſphe",
    "mateur du nom de Dieu."
   ]
  },
  {
   "type": "heading",
   "text": "ANNOT. XXXVI.",
   "spaced_caps": true
  },
  {
   "type": "paragraph",
   "continues_prev": false,
   "continues_next": true,
   "lines": [
    "Les teſmoins raportoyent qu'iceluy du Tilh eſtoit",
    "couſtumier iurer teſte, corps, ſang & playes de noſtre",
    "Seigneur: ce que vulgairement on appelle Blaſphemer:",
    "qui n'eſt autre choſe, ſelon l'expoſition des Theologiés,",
    "& Canoniſtes, qu'atribuer corps, membres, & autres",
    "choſes à Dieu, qui ne luy conuiennent point: ou bien",
    "detraire de ce que luy appartient {a}. combien qu'à la ve",
    "rité, Blaſpheme ſe doyue diffinir autrement: car laiſſant",
    "à part l'interpretation des Hebrieux, & Cabaliſtes, qui",
    "diſent Blaſphemer le nom de Dieu n'eſtre autre choſe,",
    "qu'exprimer ce grand & ineffable nom, Tetragramma",
    "ton (qui ne ſe doit pronõcer ou eſcrire) Par ces lettres,",
    "& caracteres faut entendre que Blaſpheme, eſt vn nom",
    "tiré du Grec, qui ſignifie deteſtation, iniure, meſpris, ma",
    "ledicẽce, & vitupere. Dont Blaſphemer, à parler propre",
    "ment, eſt meſpriſer, deteſter, & contumelier Dieu, ou",
    "ſon fils Ieſus Chriſt {b}, les prouoquant d'opprobres &",
    "iniures {c}. Ainſi quãd les Iuifs iettoient des pierres cõtre",
    "noſtre Sauueur Ieſus-chriſt, ils diſoiẽt le lapider, nõ pas",
    "pour bonnes œuures (comme le Seigneur iuſtemẽt ſe",
    "plaignoit:) mais pour Blaſpheme {d}. Et tels Blaſphema-",
    "teurs, par la loy anciẽne eſtoient lapidez du peuple {e} de",
    "laquelle nos cõſtitutiõs ciuiles eſpuiſées, condẽnent les",
    "Blaſphemateurs à mort: ce que deuroit eſtre religieu-",
    "ſement gardé: & (cõme dit ſainct Gregoire) ſans vſer de",
    "miſericorde aucune {f}: pourueu toutesfois qu'ils ſoient",
    "couſtumiers & endurcis à ce faire {g}. Autremẽt pour vne,",
    "deux & trois fois, la loy ne les fait pas mourir (ne voulãt",
    "tirer à peine de mort trop facilement vn gliſſement, &",
    "lubricité de langage {h}:) mais les puniſt extraordinaire-",
    "mẽt, ſelon la qualité des perſonnes, & autres circonſtan",
    "ces obſeruées: le tout remis à l'arbitre du iuge {i}: d'autãt",
    "que la loy pẽſe, tels blaſphemes inaccouſtumez, proce-",
    "der plus de quelque paſſion, legereté d'eſprit, ou mau"
   ]
  }
 ],
 "margin_notes": [
  {
   "key": "a",
   "beside_line": "detraire de ce que luy appartient {a}. combien qu'à la ve",
   "lines": [
    "Iean d'Arno",
    "nie au fina.",
    "de maled."
   ]
  },
  {
   "key": "b",
   "beside_line": "ſon fils Ieſus Chriſt {b}, les prouoquant d'opprobres &",
   "lines": [
    "Aut. alearũ"
   ]
  },
  {
   "key": "c",
   "beside_line": "iniures {c}. Ainſi quãd les Iuifs iettoient des pierres cõtre",
   "lines": [
    "de religioſ",
    "Leuitique. c. xxiiij."
   ]
  },
  {
   "key": "d",
   "beside_line": "plaignoit:) mais pour Blaſpheme {d}. Et tels Blaſphema-",
   "lines": [
    "S. Iean. c. x."
   ]
  },
  {
   "key": "e",
   "beside_line": "teurs, par la loy anciẽne eſtoient lapidez du peuple {e} de",
   "lines": [
    "Leuitique.",
    "c. xiiij."
   ]
  },
  {
   "key": "f",
   "beside_line": "miſericorde aucune {f}: pourueu toutesfois qu'ils ſoient",
   "lines": [
    "c. reos ſan-",
    "guinis. c. xiiij.",
    "q. v."
   ]
  },
  {
   "key": "g",
   "beside_line": "couſtumiers & endurcis à ce faire {g}. Autremẽt pour vne,",
   "lines": [
    "Paragr. fin.",
    "aux nouuel-",
    "les de Iuſti-",
    "nien, vt non",
    "luxur. ho. cor.",
    "nat. ſoubz la",
    "iiij. collat."
   ]
  },
  {
   "key": "h",
   "beside_line": "lubricité de langage {h}:) mais les puniſt extraordinaire-",
   "lines": [
    "l. famoſi.",
    "D. ad l. Iuliã.",
    "maieſtatis."
   ]
  },
  {
   "key": "i",
   "beside_line": "ces obſeruées: le tout remis à l'arbitre du iuge {i}: d'autãt",
   "lines": [
    "Les interpre-",
    "tes en la loy. v.",
    "C. de reb. cre.",
    "P. item ſi quis",
    "poſtulante. de",
    "actio."
   ]
  }
 ],
 "foot_notes": [],
 "ornaments": [],
 "uncertain": [
  {
   "where": "running_head",
   "text": "PARLEMENT DE THOLOSE",
   "note": "no terminal point visible after 'THOLOSE' at this resolution, unlike p055's recto running head 'PARLEMENT DE THOLOSE.' which the final transcription records with a point. Transcribed as printed (no point); reconciler should check at higher zoom whether a point is present and worn.",
   "escalate": true
  },
  {
   "where": "margin_notes[0]",
   "text": "Iean d'Arno nie au fina. de maled.",
   "note": "this three-line note is very compressed italic and I cannot resolve the name with confidence. My literal best reading of the strokes is given, but the page's topic (blasphemy) and the citation style of the neighboring notes make it plausible this is actually 'Iean d'André...de maledicis' (Johannes Andreae commenting on the Decretals title 'De maledicis', X 5.26, which covers blasphemy/cursing) — the line break as printed does not map cleanly onto that hypothesis either, so it is not adopted as the transcription. Flagging for the reconciler / higher-zoom check.",
   "escalate": true
  },
  {
   "where": "margin_notes[1]",
   "text": "b Aut. alearũ",
   "note": "the key letter beside this one-line note could be 'b' or 'h' in this italic font (the two are easily confused at this resolution, and the same ambiguity recurs at the body marker after 'langage'). Read as 'b' because it is the second note on the page, matching the second body marker (after 'Ieſus Chriſt'), leaving 'h' for the marker after 'langage', which agrees with margin_notes[7]'s legal-citation content. Flagging the key-letter identification for the reconciler.",
   "escalate": true
  },
  {
   "where": "margin_notes[2].lines[0]",
   "text": "de religioſ",
   "note": "line ends 'religioſ' with no visible line-end hyphen or continuation mark; likely the complete word 'religioſis' cut short in my reading, or the word genuinely ends here and a hyphen was missed. Not resolved further per the no-recrop rule.",
   "escalate": false
  },
  {
   "where": "margin_notes[8]",
   "text": "Les interpre-tes en la loy.v. / C. de reb. cre. / P. item ſi quis poſtulante. de actio.",
   "note": "no key letter is visible at the head of this note (it begins directly with the capital 'L' of 'Les'), unlike every other note on the page. The body's marker {i} (after 'iuge') has no other candidate note, and the citation's subject (interpreters of the law, the judge's discretion) fits the body text beside it, so this note is assigned key 'i' by position and content rather than a read key letter. The reconciler should check whether a small italic 'i' is present and simply not resolved at this resolution.",
   "escalate": true
  },
  {
   "where": "blocks[2].lines[29]",
   "text": "lubricité de langage {h}:) mais les puniſt extraordinaire-",
   "note": "'puniſt' read as long-s + t (ligature); could alternatively be 'punift' with a different final consonant, but 'puniſt' (16th-c. spelling of 'punit') is the sensible reading and matches the ſt-ligature form used elsewhere on the page.",
   "escalate": false
  },
  {
   "where": "blocks[2].lines[33]",
   "text": "der plus de quelque paſſion, legereté d'eſprit, ou mau",
   "note": "line ends 'ou mau' with no hyphen, continuing to the next page (likely '-uaiſe' or similar); no hyphen is printed, which is normal for this print and needs no correction.",
   "escalate": false
  },
  {
   "where": "margin_notes",
   "note": "counts for the reconciler: 9 markers in the body ({a} through {i}, printer's alphabet a-i) and 9 margin notes, all in the outer margin — no foot citation block, no signature, no catchword, no ornament or decorated initial on this page. The alphabet appears to restart at 'a' for this ANNOT. XXXVI. section (p056's single marker was also keyed 'a', per its own note to the reconciler about a possible restart at that ANNOT. section boundary).",
   "escalate": false
  }
 ]
}
