{
 "id": "p092",
 "reader": "final",
 "model": "arbitration",
 "running_head": "ARREST. DV",
 "folio": "92",
 "signature": null,
 "catchword": null,
 "ornaments": [],
 "blocks": [
  {
   "type": "paragraph",
   "continues_prev": true,
   "continues_next": true,
   "lines": [
    "profeſſeurs de telles reſueries ſe vantent pouuoir re-",
    "couurer des eſprits, & par leurs preſtiges & illuſions fai",
    "re toutes choſes: iuſques à attiret les aſtres du ciel. teſ-",
    "moin Vergile quand il dit {h}."
   ]
  },
  {
   "type": "paragraph",
   "continues_prev": true,
   "continues_next": false,
   "lines": [
    "Carmina, Vel cœlo poſſunt deducere Lunam."
   ]
  },
  {
   "type": "paragraph",
   "continues_prev": false,
   "continues_next": true,
   "lines": [
    "De cette magie, les vns en font deux eſpeces, Goetie,",
    "& Theurgie. Les autres (comme Marc Varron) quatre:",
    "Necromance, Pyromance, Aeromance, & Hydroman-",
    "ce {i}. Les plus recens adiouſtent à ces quatre, la Geo-",
    "mance & la Chiromance {k}. Necromance & Goetie eſt",
    "tout vn, ſignifiant l'art de deuiner par inuocation d'e-",
    "ſprits des treſpaſſez: appellee Necromance, à νεκρος, qui",
    "veut dire mort: & μαντεία, diuination {l}: & Goetie, à plan-",
    "ctu, pour le dueil qu'il faut demener à l'entour du ſepul",
    "chre, duquel on veut attirer & inuoquer l'ombre {m}. Ou",
    "bien & le plus ſouuent cet art pernicieux ſ'exerce par",
    "inuocation dés eſprits immundes & mauuais: com-",
    "me quand les enchanteurs de Pharaon conuertiſſoyent",
    "les verges en ſerpens, & les eaux des fleuues en ſang {n},",
    "& la Phitoniſſe d'Endor, à la requeſte du Roy Saül",
    "fit venir par ſon eſprit familier, l'ame de Samuel {o}. car",
    "ainſi que pluſieurs interpretent, ce n'eſtoit pas l'ame du",
    "Prophete: mais de quelque mauuais eſprit, qui auoit",
    "prins ſa forme {p}, ou bien vn ſpectre ou fantoſme. De la",
    "Goetie eſt differente la Theurgie, en ce que la Theur-",
    "gie ſ'exerce par inuocation de Dieu & des bons eſprits,",
    "comme des Anges, par laquelle moyennant les abſti-",
    "nences & autres ceremonies requiſes, pluſieurs ont pen-",
    "ſé pouuoir attraire les puiſſances celeſtes, & vertus di-",
    "uines: ce qu'on attribue à Appolonius Thianeus, du-",
    "quel on recite choſes merueilleuſes: meſmement qu'il",
    "entendoit le iargon des oyſeaux: ſçauoit dire tout ce",
    "qu'on faiſoit és plus eſtranges & ſeparees contrees du",
    "monde: parloit toutes langues, ſans oncques auoir eſté",
    "apprins: declaroit les penſees des hommes, prediſoit",
    "les choſes à venir: & (qui eſt ſur tout amiable, & qu'vn",
    "Chreſtien ne doit facilement, croire) reſſuſcitoit les",
    "morts. ce qu'il ſe vantoit faire par le conſeil de Dieu, &"
   ]
  }
 ],
 "margin_notes": [
  {
   "key": "h",
   "beside_line": "re toutes choſes: iuſques à attiret les aſtres du ciel. teſ-",
   "lines": [
    "Vergile au",
    "xiij. des Aen."
   ]
  },
  {
   "key": "i",
   "beside_line": "& Theurgie. Les autres (comme Marc Varron) quatre:",
   "lines": [
    "M. Varro",
    "au vij. diui-",
    "narum rerũ."
   ]
  },
  {
   "key": "k",
   "beside_line": "ce {i}. Les plus recens adiouſtent à ces quatre, la Geo-",
   "lines": [
    "Polidore au",
    "liure j. de In-",
    "uentor. rer. c.",
    "xxiij."
   ]
  },
  {
   "key": "l",
   "beside_line": "veut dire mort: & μαντεία, diuination {l}: & Goetie, à plan-",
   "lines": [
    "c. fin. xxvj.",
    "q. v."
   ]
  },
  {
   "key": "m",
   "beside_line": "ctu, pour le dueil qu'il faut demener à l'entour du ſepul",
   "lines": [
    "S. Augu-",
    "ſtin au liure",
    "de ciuit. Dei.",
    "c. ix. x. & xj."
   ]
  },
  {
   "key": "n",
   "beside_line": "fit venir par ſon eſprit familier, l'ame de Samuel {o}. car",
   "lines": [
    "Exod. c. vij."
   ]
  },
  {
   "key": "o",
   "beside_line": "ainſi que pluſieurs interpretent, ce n'eſtoit pas l'ame du",
   "lines": [
    "Au premier",
    "des Rois c.",
    "xxviij."
   ]
  },
  {
   "key": "p",
   "beside_line": "prins ſa forme {p}, ou bien vn ſpectre ou fantoſme. De la",
   "lines": [
    "c. fi. P. præ-",
    "terea. xxvj.",
    "q. v."
   ]
  }
 ],
 "foot_notes": [],
 "uncertain": [
  {
   "where": "running_head",
   "text": "ARREST. DV",
   "note": "spaced capitals; a period is printed after ARREST"
  },
  {
   "where": "blocks[0].lines[2]",
   "text": "re toutes choſes: iuſques à attiret les aſtres du ciel. teſ-",
   "note": "sic: 'attiret' (wrong sort for 'attirer'); final letter looks like t"
  },
  {
   "where": "blocks[1].lines[0]",
   "text": "Carmina, Vel cœlo poſſunt deducere Lunam.",
   "note": "italic verse; 'Vel' printed with a swash capital V"
  },
  {
   "where": "blocks[2].lines[2]",
   "text": "Necromance, Pyromance, Aeromance, & Hydroman-",
   "note": "'Aeromance' second letter could be a c ('Acromance', wrong sort); read as e with low confidence"
  },
  {
   "where": "blocks[2].lines[6]",
   "text": "ſprits des treſpaſſez: appellee Necromance, à νεκρος, qui",
   "note": "Greek word small and worn; second letter could be ι (printed 'νικρος'?); no accents visible"
  },
  {
   "where": "blocks[2].lines[7]",
   "text": "veut dire mort: & μαντεία, diuination {l}: & Goetie, à plan-",
   "note": "Greek τ printed as a ligature-like sort; punctuation after 'mort' and after marker l could be ';' rather than ':'"
  },
  {
   "where": "blocks[2].lines[11]",
   "text": "inuocation dés eſprits immundes & mauuais: com-",
   "note": "'dés' appears to carry an accent; could be ink"
  },
  {
   "where": "blocks[2].lines[27]",
   "text": "qu'on faiſoit és plus eſtranges & ſeparees contrees du",
   "note": "a raised dot after 'plus' ignored as stray ink"
  },
  {
   "where": "blocks[2].lines[31]",
   "text": "Chreſtien ne doit facilement, croire) reſſuſcitoit les",
   "note": "comma before 'croire' as printed (set tight to croire); sic"
  },
  {
   "where": "margin_notes[0].lines[1]",
   "text": "xiij. des Aen.",
   "note": "numeral could be 'xij.'; first stroke blurred"
  },
  {
   "where": "blocks[0].lines[2]",
   "text": "re toutes choſes: iuſques à attiret les aſtres du ciel. teſ-",
   "note": "'attiret' as printed (for 'attirer'); sic"
  },
  {
   "where": "blocks[0].lines[0]",
   "text": "profeſſeurs de telles reſueries ſe vantent pouuoir re-",
   "note": "no preceding page transcription available; continues_prev inferred from lowercase start mid-sentence"
  },
  {
   "where": "blocks[1].lines[0]",
   "text": "Carmina, Vel cœlo poſſunt deducere Lunam.",
   "note": "italic verse quotation (Virgil, Ecl. viii); 'Vel' printed with a swash capital V as transcribed"
  },
  {
   "where": "blocks[2].lines[7]",
   "text": "veut dire mort: & μαντεία, diuination {l}: & Goetie, à plan-",
   "note": "Greek 'μαντεία' printed with an odd τ sort (looks like ]); punctuation after 'mort' and after {l} could be ';' rather than ':'"
  },
  {
   "where": "blocks[2].lines[11]",
   "text": "inuocation dés eſprits immundes & mauuais: com-",
   "note": "'dés' with accent as it appears; accent mark could be a spot"
  },
  {
   "where": "blocks[2].lines[24]",
   "text": "uines: ce qu'on attribue à Appolonius Thianeus, du-",
   "note": "print shows 'qù on' / 'qu' on' — an apostrophe or accent over the u with a gap; could be read 'qui on'"
  },
  {
   "where": "blocks[2].lines[30]",
   "text": "les choſes à venir: & (qui eſt ſur tout amiable, & qu'vn",
   "note": "'amiable' as printed (sense wants 'admirable'); sic"
  },
  {
   "where": "blocks[2].lines[31]",
   "text": "Chreſtien ne doit facilement, croire) reſſuſcitoit les",
   "note": "a small raised comma-like mark between 'facilement' and 'croire'; may be a spot rather than a comma"
  },
  {
   "where": "margin_notes[0].lines[1]",
   "text": "xiij. des Aen.",
   "note": "first sort looks like a ʒ-shaped x; reading 'xiij' (Aeneid xii would be expected; could be 'xij' with extra i?)"
  },
  {
   "where": "margin_notes[6].lines[1]",
   "text": "des Rois c.",
   "note": "print looks like 'Rou' — may be a misprint 'Rou' or italic 'is' ligature; best reading 'Rois'"
  }
 ],
 "decisions": [
  {
   "where": "blocks[2].lines[6]",
   "A": "ſprits des treſpaſſez: appellee Necromance, à νεκρος, qui",
   "B": "ſprits des treſpaſſez: appellee Necromance, à νικρος, qui",
   "chose": "carson-session",
   "by": "translator",
   "text": "ſprits des treſpaſſez: appellee Necromance, à νεκρος, qui",
   "reason": "arbitration: A (translator: νεκρός is the Greek word for a dead man that Coras is glossing ('qui veut dire mort'); νικρος is no word.)"
  },
  {
   "where": "blocks[2].lines[24]",
   "A": "uines: ce qù on attribue à Appolonius Thianeus, du-",
   "B": "uines: ce qu'on attribue à Appolonius Thianeus, du-",
   "chose": "carson-session",
   "by": "translator",
   "text": "uines: ce qu'on attribue à Appolonius Thianeus, du-",
   "reason": "arbitration: B (translator: qu'on ('which one attributes') is the word; qù on sets an accent sort where the apostrophe belongs.)"
  },
  {
   "where": "margin_notes[6].lines[1]",
   "A": "des Rou c.",
   "B": "des Rois c.",
   "chose": "carson-session",
   "by": "translator",
   "text": "des Rois c.",
   "reason": "arbitration: B (translator: Rois: 'the first of Kings, chapter 28' is the witch of Endor (1 Samuel 28 in the Hebrew numbering); Rou is no word.)"
  }
 ]
}
