{
 "id": "p110",
 "reader": "A",
 "model": "opus",
 "running_head": "ARREST DV",
 "folio": "110",
 "signature": null,
 "catchword": null,
 "blocks": [
  {
   "type": "paragraph",
   "continues_prev": true,
   "continues_next": false,
   "lines": [
    "rement que iaçoit la difference donnée par nos loix",
    "quant à l'impoſitiõ des peines entre les nobles, & ceux",
    "de baſſe condition {a}, ne ſoit pas eſtroitement gardée",
    "en France, ou l'ont tient plus tenacement celle reigle",
    "generale, que les crimes & forfaits reiettent, & aneantiſ-",
    "ſent toute dignité, & tous les priuileges {b}: toutesfois és",
    "iugemens de mort le François ont religieuſement ob",
    "ſerué de tout temps, que les nobles ſont decapitez, &",
    "les autres pendus {c}. Encore teſmoignent quelques vns",
    "d'auantage eſtre gardé en France, que ſi vne perſonne,",
    "tant noble, & illuſtre qu'elle ſoit, commet quelque pro",
    "dition & trahiſon notable, on ne la decole point, mais",
    "on la pend en vn gibet, & en fourches plus hautes &",
    "plus eſleuees que les autres {d}."
   ]
  },
  {
   "type": "heading",
   "text": "TEXTE.",
   "spaced_caps": true
  },
  {
   "type": "heading",
   "text": "Fauſſeté."
  },
  {
   "type": "heading",
   "text": "ANNOT. LXXXI.",
   "spaced_caps": true
  },
  {
   "type": "paragraph",
   "continues_prev": false,
   "continues_next": true,
   "lines": [
    "Le crime de faux eſt ici patent: par le changement",
    "du nom, & ſuppoſition de la perſonne: ayant ledit du",
    "Tilh aſſeuré, qu'il ſ'appeloit & eſtoit Martin Guerre:",
    "car bien qu'il ſoit loiſible à chacun changer de nom à",
    "ſon plaiſir {a2}, d'autant que les noms ne ſont impoſez que",
    "pour recognoiſtre les perſonnes, & diſcerner les vnes",
    "des autres {b2}: cela toutesfois ſ'entend auec bonne foy,",
    "& ſans intention de frauder, ou endommager autruy {c2}.",
    "comme quand le Pape Sergius, ſecond de ce nom, qui",
    "ſ'appeloit en Italien, Bocca di porco: c'eſt a dire Bou-",
    "che de pourceau, ſ'eſtoit fait nommer Sergius: dont de-",
    "puis les Pontifes de Rome ont tiré la couſtume, de laiſ",
    "ſer à leur creation leur nom propre, pour en prendre",
    "vn autre à exemple auſſi (comme ils diſent) de Ieſus",
    "Chriſt, qui donna le nom de Pierre à Simon Bariona",
    "lors qu'il le choiſit pour ſon diſciple. {d2} Pourueu donc-",
    "ques que la volonté ne ſoit mauuaiſe, on peut, non ſeu-",
    "lement changer de nom, mais encore du ſu nom, & d'ar",
    "moiries {e2}, & ſe dire d'vn autre pays: comme quand S.",
    "Paul, aux Actes des Apoſtres, ſe diſoit citoyen de Ro-",
    "me, bien qu'il n'en fut point {f2}. Et Ieſus Chriſt, parlant"
   ]
  }
 ],
 "margin_notes": [
  {
   "key": "a",
   "beside_line": "de baſſe condition {a}, ne ſoit pas eſtroitement gardée",
   "lines": [
    "l. milites. C.",
    "de quaſ l. ho-",
    "nor. D. de pœn."
   ]
  },
  {
   "key": "b",
   "beside_line": "ſent toute dignité, & tous les priuileges {b}: toutesfois és",
   "lines": [
    "l. i. C. vbi",
    "ſenator l. Indi",
    "gnat. li. xij."
   ]
  },
  {
   "key": "c",
   "beside_line": "ſerué de tout temps, que les nobles ſont decapitez, &",
   "lines": [
    "Accurſe en",
    "la l. ij. P. i.",
    "D. de re milit."
   ]
  },
  {
   "key": "d",
   "beside_line": "plus eſleuees que les autres {d}.",
   "lines": [
    "Balde au c.",
    "qnidã de iure."
   ]
  },
  {
   "key": "a2",
   "beside_line": "Le crime de faux eſt ici patent: par le changement",
   "lines": [
    "l. vn D. de",
    "mura no."
   ]
  },
  {
   "key": "b2",
   "beside_line": "du nom, & ſuppoſition de la perſonne: ayant ledit du",
   "lines": [
    "l. ad reco-",
    "gnoſcendos. C.",
    "de ingen. &",
    "man. P. ſed",
    "quia. qui mo-",
    "dis teſt. infir."
   ]
  },
  {
   "key": "c2",
   "beside_line": "des autres {b2}: cela toutesfois ſ'entend auec bonne foy,",
   "lines": [
    "l. vnique al",
    "leguee. Et ci",
    "deſſus en l'a-",
    "notarion, xij."
   ]
  },
  {
   "key": "d2",
   "beside_line": "ſ'appeloit en Italien, Bocca di porco: c'eſt a dire Bou-",
   "lines": [
    "Pierre Cri-",
    "nit. ru iij. de",
    "honeſta diſci-",
    "pli. c. x."
   ]
  },
  {
   "key": "e2",
   "beside_line": "ſer à leur creation leur nom propre, pour en prendre",
   "lines": [
    "c. dilecta. là",
    "où Panorme",
    "de exceſ. pra-",
    "laror."
   ]
  },
  {
   "key": "f2",
   "beside_line": "lors qu'il le choiſit pour ſon diſciple. {d2} Pourueu donc-",
   "lines": [
    "Actes c. xvj."
   ]
  },
  {
   "key": null,
   "beside_line": "ques que la volonté ne ſoit mauuaiſe, on peut, non ſeu-",
   "lines": [
    "ſiue adulte-",
    "rium. x. diſt."
   ]
  }
 ],
 "foot_notes": [],
 "ornaments": [],
 "uncertain": [
  {
   "where": "blocks[0].lines[0]",
   "text": "rement que iaçoit la difference donnée par nos loix",
   "note": "'difference': the r is broken/half-inked (looks like 'diffeıence'); read as r"
  },
  {
   "where": "blocks[0].lines[5]",
   "text": "ſent toute dignité, & tous les priuileges {b}: toutesfois és",
   "note": "'toutesfois': the f is almost not inked (gap between 'toutes' and 'ois'); best reading f"
  },
  {
   "where": "blocks[0].lines[6]",
   "text": "iugemens de mort le François ont religieuſement ob",
   "note": "'le François' printed so (sense wants 'les'); sic"
  },
  {
   "where": "blocks[0].lines[7]",
   "text": "ſerué de tout temps, que les nobles ſont decapitez, &",
   "note": "print sets a space before the comma after 'decapitez'; normalized"
  },
  {
   "where": "blocks[0].lines[13]",
   "text": "plus eſleuees que les autres {d}.",
   "note": "'eſleuees' appears without accent on the e; could be 'eſleuées' with a faint accent"
  },
  {
   "where": "blocks[2]",
   "text": "Fauſſeté.",
   "note": "display line in larger roman type; treated as heading"
  },
  {
   "where": "blocks[3]",
   "text": "ANNOT. LXXXI.",
   "note": "final point after I is a small raised mark, read as period"
  },
  {
   "where": "blocks[4].lines[2]",
   "text": "Tilh aſſeuré, qu'il ſ'appeloit & eſtoit Martin Guerre:",
   "note": "'ſ'appeloit': the o looks dotted ('appelöit'), probably ink spot"
  },
  {
   "where": "blocks[4].lines[6]",
   "text": "des autres {b2}: cela toutesfois ſ'entend auec bonne foy,",
   "note": "line-end mark after 'foy' could be ',' or ';'"
  },
  {
   "where": "blocks[4].lines[15]",
   "text": "lors qu'il le choiſit pour ſon diſciple. {d2} Pourueu donc-",
   "note": "marker d printed after the period ('diſciple .d'); line-end sign after 'donc' looks like a dot, read as hyphen"
  },
  {
   "where": "blocks[4].lines[16]",
   "text": "ques que la volonté ne ſoit mauuaiſe, on peut, non ſeu-",
   "note": "mark after 'peut' is small and high; could be a comma or stray mark"
  },
  {
   "where": "blocks[4].lines[17]",
   "text": "lement changer de nom, mais encore du ſu nom, & d'ar",
   "note": "'ſu nom' printed with a gap and no r (sense 'ſurnom'); sic. Line-end 'd'ar' - last letter damaged, could be 'd'at'"
  },
  {
   "where": "blocks[4].lines[18]",
   "text": "moiries {e2}, & ſe dire d'vn autre pays: comme quand S.",
   "note": "'pays' p poorly inked (looks like 'oays')"
  },
  {
   "where": "blocks[4].lines[20]",
   "text": "me, bien qu'il n'en fut point {f2}. Et Ieſus Chriſt, parlant",
   "note": "last word's final letter damaged ('parlans'?); read 'parlant'"
  },
  {
   "where": "margin_notes[0].lines[1]",
   "text": "de quaſ l. ho-",
   "note": "'quaſ' could be 'quæſ' (quæſtionibus abbreviation); a/æ unclear"
  },
  {
   "where": "margin_notes[1].lines[2]",
   "text": "gnat. li. xij.",
   "note": "'xij' printed with the ij ligature (ÿ-shape)"
  },
  {
   "where": "margin_notes[2].lines[1]",
   "text": "la l. ij. P. i.",
   "note": "'ij' printed as ÿ-shape ligature; could be 'iij' if a preceding i is present"
  },
  {
   "where": "margin_notes[3].lines[1]",
   "text": "qnidã de iure.",
   "note": "sic: 'qnidã' (turned u for 'quidã')"
  },
  {
   "where": "margin_notes[4]",
   "text": "l. vn D. de / mura no.",
   "note": "alphabet restarts at a in ANNOT. LXXXI, keyed a2-f2. 'l. vn D.' reading doubtful (vnica?); 'mura no.' likely abbreviated 'mutatione nominis'"
  },
  {
   "where": "margin_notes[7].lines[1]",
   "text": "nit. ru iij. de",
   "note": "'ru' as printed (sense 'li.'?); numeral printed 'iiÿ', read iij, could be iiij"
  },
  {
   "where": "margin_notes[6].lines[3]",
   "text": "notarion, xij.",
   "note": "sic: 'notarion' for 'notation'; 'xij' printed ÿ-shape"
  },
  {
   "where": "margin_notes[8].lines[2]",
   "text": "de exceſ. pra-",
   "note": "'pra-' as printed, likely for 'præ-'; ligature not visible"
  },
  {
   "where": "margin_notes[8].lines[3]",
   "text": "laror.",
   "note": "'laror.' as printed (sense 'lator.'/prælator.); a stray mark follows the period"
  },
  {
   "where": "margin_notes[8].lines[1]",
   "text": "où Panorme",
   "note": "the o of 'Panorme' is blotted"
  },
  {
   "where": "margin_notes[10]",
   "text": "ſiue adulte- / rium. x. diſt.",
   "note": "note begins with a small mark (not a clear letter), possibly a continuation of e2's or f2's note or a mis-set key; no body marker found"
  }
 ]
}
