{
 "id": "p018",
 "reader": "A",
 "model": "opus",
 "running_head": "ARREST DV",
 "folio": "18",
 "blocks": [
  {
   "type": "paragraph",
   "continues_prev": true,
   "continues_next": true,
   "lines": [
    "chauffé, ſ'en va droit à ſa maiſon trouuer ſa femme, la",
    "iette ſur le lict, luy diſant qu'il la vouloit engroſſir d'vn",
    "dia[?]le. Ce qu'il fit, ou pour le moins d'vn fils qui eut la",
    "forme d'vn diabloton, & qui commença dés qu'il fut né",
    "à ſauteller, & bondir {u}. Et ſi le lecteur ne ſe contente,"
   ]
  }
 ],
 "margin_notes": [
  {
   "key": "u",
   "lines": [
    "Loys Viues",
    "au xv. liur. de",
    "S. Aug. de la",
    "cité de Dieu."
   ],
   "beside_line": "à ſauteller, & bondir {u}. Et ſi le lecteur ne ſe contente,"
  }
 ],
 "foot_notes": [],
 "signature": null,
 "catchword": null,
 "ornaments": [],
 "uncertain": [
  {
   "where": "blocks[0].lines[2]",
   "text": "dia[?]le. Ce qu'il fit, ou pour le moins d'vn fils qui eut la",
   "note": "ink blot over the b",
   "escalate": false
  }
 ]
}
