{
 "id": "p156",
 "reader": "A",
 "model": "opus",
 "running_head": "ARREST DV",
 "folio": "156",
 "signature": null,
 "catchword": null,
 "ornaments": [],
 "blocks": [
  {
   "type": "paragraph",
   "continues_prev": true,
   "continues_next": false,
   "lines": [
    "qui donne preſentement quelque choſe, iure de garder",
    "ſa liberalité, & ne cõtreuenir point à ce qu'il promet, &",
    "donne. Mais celuy qui recognoiſt & iure auoir pieça re",
    "ceu quelque ſomme d'argent ou autre choſe, interpoſe",
    "ſon ſerment ſur ce qu'eſt deſia fait, & paſſé. C'eſt à dire,",
    "ſur ce qu'a eſté ia deuant receu par le recognoiſſant."
   ]
  },
  {
   "type": "heading",
   "text": "TEXTE.",
   "spaced_caps": true
  },
  {
   "type": "paragraph",
   "continues_prev": false,
   "continues_next": false,
   "lines": [
    "Apres inſtitue ſon heritiere ſa fille Ber",
    "narde du Tilh, qu'il auoit euë de ladite",
    "Bertrande de Rols: & luy donne tuteurs,",
    "Iean du Tilh ſon frere, habitant du Pin,",
    "& Dominique Rebendaire, habitant de",
    "Toloſe."
   ]
  },
  {
   "type": "heading",
   "text": "ANNOTAT. CX.",
   "spaced_caps": true
  },
  {
   "type": "paragraph",
   "continues_prev": false,
   "continues_next": true,
   "lines": [
    "Vne belle queſtion ſe preſente ici, ſi cette inſtitution",
    "d'heritier eſt valable, & par ainſi ſi vn homme condem-",
    "né à mort, peut faire teſtament, & bien que telle al-",
    "tercation pourra ſembler à pluſieurs ſans difficulté,",
    "partant que nos Iuriſconſultes, & auec eux Iuſtinien",
    "en diuers lieux enſeignẽt, que les teſtamẽs là faits ſont",
    "caſſés & rompus par la condemnation de mort ſuyuãte,",
    "tãt ſ'en faut que le condẽné en puiſſe faire de nouueaux",
    "apres la ſentence {a}. Toutesfois de graues autheurs en",
    "noſtre Iuriſprudence, recitent auoir ſouuentesfois veu",
    "faire teſtamens aux condemnez à mort: mais n'auoir",
    "oncques entendu caſſation d'aucun {b}. Ioint que par les",
    "nouuelles conſtitutions de Iuſtinien, ſemble que ce-",
    "ſte rigueur de loy, ne voulant permettre aux condẽnez",
    "la faculté de teſter, aye receu quelque changement {c}.",
    "partant que la raiſon, ſur laquelle l'interdiction de te-",
    "ſter, és condamnez à mort, eſtoit fondee (qu'eſt par ce",
    "que où quelqu'vn eſtoit condemné à mort, ſon bien,",
    "auſſi eſtoit confiſqué. & par ainſi, n'ayant point de biẽ,",
    "ne pouuoit teſter {e}) ſemble ceſſer auiourdhuy, eſtans",
    "les biens par la nouuelle loy, hors de confiſcation, &",
    "reſeruez aux plus prochains ſucceſſeurs ab inteſtat. Si"
   ]
  }
 ],
 "margin_notes": [
  {
   "key": "y",
   "beside_line": "ſur ce qu'a eſté ia deuant receu par le recognoiſſant.",
   "lines": [
    "Bartole en la",
    "l. quis pro eo",
    "D. de fideiuſ-",
    "ſo."
   ]
  },
  {
   "key": "a",
   "beside_line": "Vne belle queſtion ſe preſente ici, ſi cette inſtitution",
   "lines": [
    "l. eius P. j. l.",
    "ſi cui. P. j. D.",
    "de teſta, l, ſi",
    "quis exhere-",
    "dato, P. irritũ.",
    "D. de iniuſt. te",
    "ſta. P. alio. q",
    "mol. eſt. infir."
   ]
  },
  {
   "key": "b",
   "beside_line": "caſſés & rompus par la condemnation de mort ſuyuãte,",
   "lines": [
    "Alberique",
    "en la l. eius, P.",
    "ſi cui, prealle-",
    "guee, & en",
    "l'Auten bona",
    "C. de bon. pro",
    "ſcrip."
   ]
  },
  {
   "key": "c",
   "beside_line": "nouuelles conſtitutions de Iuſtinien, ſemble que ce-",
   "lines": [
    "P, Dernier",
    "vt nulli iudi.",
    "coll. ix. & en",
    "l'Autent. bo-",
    "na."
   ]
  },
  {
   "key": "d",
   "beside_line": "ſter, és condamnez à mort, eſtoit fondee (qu'eſt par ce",
   "lines": [
    "l. i. P. der-",
    "nier l derniere",
    "D. de bon. dã",
    "nato."
   ]
  },
  {
   "key": "e",
   "beside_line": "ne pouuoit teſter {e}) ſemble ceſſer auiourdhuy, eſtans",
   "lines": [
    "Autent, in-",
    "greſſi C. de ſa",
    "croſanct. eccl."
   ]
  }
 ],
 "foot_notes": [],
 "uncertain": [
  {
   "where": "blocks[0].lines[5]",
   "text": "ſur ce qu'a eſté ia deuant receu par le recognoiſſant.",
   "note": "no marker y visible in the body; margin note y is printed beside this line (alphabet continues from x on p155), marker probably omitted or lost"
  },
  {
   "where": "blocks[4].lines[16]",
   "text": "ſter, és condamnez à mort, eſtoit fondee (qu'eſt par ce",
   "note": "no marker d visible anywhere in the body; margin note d begins beside this line"
  },
  {
   "where": "blocks[4].lines[11]",
   "text": "oncques entendu caſſation d'aucun {b}. Ioint que par les",
   "note": "'caſſation' may be printed 'caſſarion' (r for t, sic); letter after second a looks r-like"
  },
  {
   "where": "blocks[4].lines[7]",
   "text": "tãt ſ'en faut que le condẽné en puiſſe faire de nouueaux",
   "note": "r of 'faire' damaged/broken, reads like 'faiıe'"
  },
  {
   "where": "blocks[4].lines[0]",
   "text": "Vne belle queſtion ſe preſente ici, ſi cette inſtitution",
   "note": "'cette' t's look r-like in this type; could be 'cerre' if wrong sorts"
  },
  {
   "where": "blocks[4].lines[8]",
   "text": "apres la ſentence {a}. Toutesfois de graues autheurs en",
   "note": "middle s of 'Toutesfois' appears round"
  },
  {
   "where": "margin_notes[0].lines[1]",
   "text": "l. quis pro eo",
   "note": "could be 'qui' or 'quiu'; final letter unclear"
  },
  {
   "where": "margin_notes[1].lines[1]",
   "text": "ſi cui. P. j. D.",
   "note": "first sort blotted, looks like a ligature; read 'ſi' by comparison with note b"
  },
  {
   "where": "margin_notes[1].lines[2]",
   "text": "de teſta, l, ſi",
   "note": "comma after 'l' (not a period) as it appears"
  },
  {
   "where": "margin_notes[2].lines[5]",
   "text": "C. de bon. pro",
   "note": "an extra dot/colon mark after 'C.'; could be 'C.:'"
  },
  {
   "where": "margin_notes[4].lines[1]",
   "text": "nier l derniere",
   "note": "no point after 'l' visible"
  },
  {
   "where": "blocks[4].lines[19]",
   "text": "ne pouuoit teſter {e}) ſemble ceſſer auiourdhuy, eſtans",
   "note": "'auiourdhuy' letters partly smudged ('auiourchuy' look); no apostrophe"
  }
 ]
}
